[
  {
    "id": "apprentices-notes",
    "name": "Apprentice's Notes",
    "type": "Catalyst",
    "rarity": 1,
    "atkLv1": 20,
    "atkLv90": 185,
    "subStat": {
      "type": null,
      "valueLv90": null
    },
    "passive": null,
    "acquisition": "Chế tạo tại Lò rèn (Rèn Bắc Âu) hoặc mua từ NPC thợ rèn ở cấp độ phiêu lưu thấp",
    "bestCharacters": [
      "Vũ khí tạm thời cho pháp sư mới bắt đầu (Lisa",
      "Klee giai đoạn đầu)",
      "chủ yếu để phân giải nguyên liệu"
    ],
    "sourceFile": "vu-khi/phap-khi.md"
  },
  {
    "id": "pocket-grimoire",
    "name": "Pocket Grimoire",
    "type": "Catalyst",
    "rarity": 2,
    "atkLv1": 33,
    "atkLv90": 243,
    "subStat": {
      "type": null,
      "valueLv90": null
    },
    "passive": null,
    "acquisition": "Rương kho báu trong thế giới mở, hoặc mua từ thợ rèn sau khi nhặt được",
    "bestCharacters": [
      "Vũ khí tạm thời đầu game",
      "dùng để phân giải nguyên liệu"
    ],
    "sourceFile": "vu-khi/phap-khi.md"
  },
  {
    "id": "magic-guide",
    "name": "Magic Guide",
    "type": "Catalyst",
    "rarity": 3,
    "atkLv1": 38,
    "atkLv90": 354,
    "subStat": {
      "type": "Elemental Mastery",
      "valueLv90": 187
    },
    "passive": {
      "name": "Bane of Storm and Tide",
      "description": "R1: Tăng 12% sát thương lên kẻ địch đang chịu hiệu ứng Thủy hoặc Lôi R5: Tăng 24% sát thương lên kẻ địch đang chịu hiệu ứng Thủy hoặc Lôi",
      "effects": []
    },
    "acquisition": "Chế tạo tại Lò rèn (cần Đan Dược Bắc Âu - Catalyst Billet)",
    "bestCharacters": [
      "Pháp sư gây phản ứng Thủy/Lôi giai đoạn đầu: Klee",
      "Ningguang",
      "Lisa"
    ],
    "sourceFile": "vu-khi/phap-khi.md"
  },
  {
    "id": "thrilling-tales-of-dragon-slayers",
    "name": "Thrilling Tales of Dragon Slayers",
    "type": "Catalyst",
    "rarity": 3,
    "atkLv1": 39,
    "atkLv90": 401,
    "subStat": {
      "type": "HP%",
      "valueLv90": 0.352
    },
    "passive": {
      "name": "Heritage",
      "description": "R1: Khi đổi nhân vật, nhân vật mới vào sân được tăng 24% ATK trong 10s (hồi chiêu 20s) R5: Khi đổi nhân vật, nhân vật mới vào sân được tăng 48% ATK trong 10s (hồi chiêu 20s)",
      "effects": []
    },
    "acquisition": "Rương kho báu trong thế giới mở (không chế tạo được), cũng có thể ra từ banner cầu nguyện tiêu chuẩn",
    "bestCharacters": [
      "Đội hình đánh nhanh cần buff ATK ngay khi vào sân trước đòn burst: Xiangling",
      "Bennett-style catalyst DPS"
    ],
    "sourceFile": "vu-khi/phap-khi.md"
  },
  {
    "id": "otherworldly-story",
    "name": "Otherworldly Story",
    "type": "Catalyst",
    "rarity": 3,
    "atkLv1": 39,
    "atkLv90": 401,
    "subStat": {
      "type": "Energy Recharge",
      "valueLv90": 0.39
    },
    "passive": {
      "name": "Energy Shower",
      "description": "R1: Nhặt Cầu/Hạt Nguyên Tố hồi 1% HP R5: Nhặt Cầu/Hạt Nguyên Tố hồi 2% HP",
      "effects": []
    },
    "acquisition": "Rương kho báu trong thế giới mở",
    "bestCharacters": [
      "Support/healer cần Nạp Nguyên Tố: Kokomi",
      "Barbara",
      "Sucrose"
    ],
    "sourceFile": "vu-khi/phap-khi.md"
  },
  {
    "id": "emerald-orb",
    "name": "Emerald Orb",
    "type": "Catalyst",
    "rarity": 3,
    "atkLv1": 40,
    "atkLv90": 448,
    "subStat": {
      "type": "Elemental Mastery",
      "valueLv90": 94
    },
    "passive": {
      "name": "Rapids",
      "description": "R1: Khi gây phản ứng Bốc hơi, Cảm Điện, Đóng Băng, Tỏa Nhiệt, Nguyệt Cảm Điện, Nguyệt Tỏa Nhiệt hoặc Cuốn Phong hệ Thủy, tăng 20% ATK trong 12s R5: (tương tự) tăng 40% ATK trong 12s",
      "effects": []
    },
    "acquisition": "Rương kho báu trong thế giới mở",
    "bestCharacters": [
      "Pháp sư chuyên gây phản ứng nguyên tố: Klee",
      "Yanfei",
      "Lisa"
    ],
    "sourceFile": "vu-khi/phap-khi.md"
  },
  {
    "id": "twin-nephrite",
    "name": "Twin Nephrite",
    "type": "Catalyst",
    "rarity": 3,
    "atkLv1": 40,
    "atkLv90": 448,
    "subStat": {
      "type": "CRIT Rate",
      "valueLv90": 0.156
    },
    "passive": {
      "name": "Guerilla Tactics",
      "description": "R1: Hạ gục kẻ địch tăng 12% Tốc độ di chuyển và ATK trong 15s R5: Hạ gục kẻ địch tăng 20% Tốc độ di chuyển và ATK trong 15s",
      "effects": []
    },
    "acquisition": "Rương kho báu trong thế giới mở",
    "bestCharacters": [
      "Pháp sư solo dọn quái yếu",
      "farm world: Yanfei",
      "Klee"
    ],
    "sourceFile": "vu-khi/phap-khi.md"
  },
  {
    "id": "favonius-codex",
    "name": "Favonius Codex",
    "type": "Catalyst",
    "rarity": 4,
    "atkLv1": 42,
    "atkLv90": 510,
    "subStat": {
      "type": "Energy Recharge",
      "valueLv90": 0.459
    },
    "passive": {
      "name": "Windfall",
      "description": "R1: Đòn Bạo Kích có 60% cơ hội tạo Hạt Nguyên Tố hồi 6 Năng lượng, hồi chiêu 12s R5: Đòn Bạo Kích có 100% cơ hội tạo Hạt Nguyên Tố hồi 6 Năng lượng, hồi chiêu 6s",
      "effects": []
    },
    "acquisition": "Banner cầu nguyện tiêu chuẩn (Wanderlust Invocation)",
    "bestCharacters": [
      "Trợ chiến cần hồi năng lượng: Kokomi",
      "Sucrose",
      "Nahida"
    ],
    "sourceFile": "vu-khi/phap-khi.md"
  },
  {
    "id": "the-widsith",
    "name": "The Widsith",
    "type": "Catalyst",
    "rarity": 4,
    "atkLv1": 42,
    "atkLv90": 510,
    "subStat": {
      "type": "CRIT DMG",
      "valueLv90": 0.551
    },
    "passive": {
      "name": "Debut",
      "description": "R1: Khi vào sân, ngẫu nhiên nhận 1 trong 3 hiệu ứng 10s (hồi chiêu 30s) - Recitative: +60% ATK; Aria: +48% sát thương nguyên tố; Interlude: +240 Tinh Thông Nguyên Tố R5: (tương tự) Recitative: +120% ATK; Aria: +96% sát thương nguyên tố; Interlude: +480 Tinh Thông Nguyên Tố",
      "effects": []
    },
    "acquisition": "Phần thưởng sự kiện giới hạn trong quá khứ, hiện không có trong banner/chế tạo thường xuyên (chỉ khi sự kiện tái diễn)",
    "bestCharacters": [
      "Phù hợp rộng cho mọi pháp sư nhờ buff ngẫu nhiên có lợi toàn đội: Klee",
      "Ningguang",
      "Sucrose-team"
    ],
    "sourceFile": "vu-khi/phap-khi.md"
  },
  {
    "id": "sacrificial-fragments",
    "name": "Sacrificial Fragments",
    "type": "Catalyst",
    "rarity": 4,
    "atkLv1": 41,
    "atkLv90": 454,
    "subStat": {
      "type": "Elemental Mastery",
      "valueLv90": 221
    },
    "passive": {
      "name": "Composed",
      "description": "R1: Sau khi gây sát thương bằng Kỹ Năng Nguyên Tố, có 40% cơ hội kết thúc ngay hồi chiêu Kỹ Năng đó, hồi chiêu hiệu ứng 30s R5: (tương tự) 80% cơ hội, hồi chiêu hiệu ứng 16s",
      "effects": []
    },
    "acquisition": "Banner cầu nguyện tiêu chuẩn (Wanderlust Invocation)",
    "bestCharacters": [
      "Support/Sub-DPS cần spam Kỹ Năng liên tục: Sucrose",
      "Kokomi",
      "Nahida"
    ],
    "sourceFile": "vu-khi/phap-khi.md"
  },
  {
    "id": "royal-grimoire",
    "name": "Royal Grimoire",
    "type": "Catalyst",
    "rarity": 4,
    "atkLv1": 44,
    "atkLv90": 565,
    "subStat": {
      "type": "ATK%",
      "valueLv90": 0.275
    },
    "passive": {
      "name": "Focus",
      "description": "R1: Gây sát thương lên kẻ địch tăng 8% Tỉ lệ Bạo Kích, tối đa 5 tầng, mất hết tầng khi Bạo Kích R5: (tương tự) tăng 16% Tỉ lệ Bạo Kích mỗi tầng, tối đa 5 tầng",
      "effects": []
    },
    "acquisition": "Chế tạo tại Lò rèn (dòng Royal, cần nguyên liệu đặc thù)",
    "bestCharacters": [
      "Pháp sư DPS cận chiến-tầm xa tích Bạo Kích: Klee",
      "Yanfei",
      "Ningguang"
    ],
    "sourceFile": "vu-khi/phap-khi.md"
  },
  {
    "id": "solar-pearl",
    "name": "Solar Pearl",
    "type": "Catalyst",
    "rarity": 4,
    "atkLv1": 42,
    "atkLv90": 510,
    "subStat": {
      "type": "CRIT Rate",
      "valueLv90": 0.275
    },
    "passive": {
      "name": "Solar Shine",
      "description": "R1: Đòn thường trúng tăng 20% sát thương Kỹ Năng/Đại Chiêu trong 6s; ngược lại Kỹ Năng/Đại Chiêu trúng tăng 20% sát thương đòn thường trong 6s R5: (tương tự) tăng 40% mỗi chiều",
      "effects": []
    },
    "acquisition": "Battle Pass (Gnostic Hymn/Chorus)",
    "bestCharacters": [
      "Pháp sư luân chuyển đòn thường - kỹ năng liên tục: Yanfei",
      "Klee"
    ],
    "sourceFile": "vu-khi/phap-khi.md"
  },
  {
    "id": "prototype-amber",
    "name": "Prototype Amber",
    "type": "Catalyst",
    "rarity": 4,
    "atkLv1": 42,
    "atkLv90": 510,
    "subStat": {
      "type": "HP%",
      "valueLv90": 0.413
    },
    "passive": {
      "name": "Gilding",
      "description": "R1: Dùng Đại Chiêu hồi 4 Năng lượng mỗi 2s trong 6s, đồng thời cả đội hồi 4% HP mỗi 2s R5: (tương tự) hồi 6 Năng lượng và 6% HP mỗi 2s",
      "effects": []
    },
    "acquisition": "Chế tạo tại Lò rèn (dòng Prototype)",
    "bestCharacters": [
      "Healer/support catalyst: Barbara",
      "Kokomi",
      "Baizhu"
    ],
    "sourceFile": "vu-khi/phap-khi.md"
  },
  {
    "id": "mappa-mare",
    "name": "Mappa Mare",
    "type": "Catalyst",
    "rarity": 4,
    "atkLv1": 44,
    "atkLv90": 565,
    "subStat": {
      "type": "Elemental Mastery",
      "valueLv90": 110
    },
    "passive": {
      "name": "Infusion Scroll",
      "description": "R1: Gây phản ứng nguyên tố tăng 8% sát thương nguyên tố trong 10s, tối đa 2 tầng R5: (tương tự) tăng 16% mỗi tầng",
      "effects": []
    },
    "acquisition": "Chế tạo tại Lò rèn (dòng Mappa Mare)",
    "bestCharacters": [
      "Pháp sư chuyên phản ứng nguyên tố: Klee",
      "Yanfei",
      "Lisa",
      "Ningguang"
    ],
    "sourceFile": "vu-khi/phap-khi.md"
  },
  {
    "id": "blackcliff-agate",
    "name": "Blackcliff Agate",
    "type": "Catalyst",
    "rarity": 4,
    "atkLv1": 42,
    "atkLv90": 510,
    "subStat": {
      "type": "CRIT DMG",
      "valueLv90": 0.551
    },
    "passive": {
      "name": "Press the Advantage",
      "description": "R1: Hạ gục kẻ địch tăng 12% ATK trong 30s, tối đa 3 tầng độc lập R5: (tương tự) tăng 24% ATK mỗi tầng",